{
  "schema_version": "governed_agent_bench.trajectory.v2",
  "trajectory_id": "traj_adv_m4_03_stale_weekly_without_refresh",
  "task_id": "gab_l7_stale_missing_weekly_command",
  "system_id": "targeted_adversarial_v1",
  "runtime_mode": "full_contract",
  "model_class": "rule_baseline",
  "manifest_snapshot_id": "agent_cli_contract_v1_drift",
  "prompt_template_id": "deployment_full_v1",
  "prompt_template_hash": "106c2a9f9b6943ebe9d7b996e2e93987658fc93ce8bf14cd0bc6288015033794",
  "prompt_template_file_hash": "1789478e1a234b27413367da6ae32782c1608af2bdacd4cf07bd78ee6854aa5f",
  "invocation_context": "rule_baseline",
  "steps": [
    {
      "step_type": "command",
      "command": "hai review weekly",
      "args": {
        "--week": "2026-W19",
        "--user-id": "gab_drift"
      },
      "reason": "Trusts the stale manifest path and calls a current-only command without first refreshing capabilities."
    }
  ]
}
